<?xml version="1.0" encoding="UTF-8"?>
<instituto xmlns:xsi="http://www.w3.org/2001/XMLSchema-instance"
           xsi:noNamespaceSchemaLocation="UD4_T7B_davidBesada.xsd">

  <alumno numExpedente="1234" nome="Carlos" apelido1="Pérez" apelido2="García">
    <altura>156</altura>
  </alumno>

  <alumno numExpedente="155" nome="Paloma" apelido1="Pereiró">
    <altura>Baixo</altura>
  </alumno>

  <profesor NRP="123A456" nome="Laura" apelido1="Muñoz" apelido2="López"/>
  <profesor NRP="3332A590" nome="Mariña" apelido1="Cerviño" apelido2="Dominguez"/>

  <alumno numExpedente="3442" nome="Fernando" apelido1="Puga" apelido2="Prado">
    <altura>178</altura>
  </alumno>

</instituto>
